"use strict";(self.webpackChunk_N_E=self.webpackChunk_N_E||[]).push([[325],{1325:(e,t,n)=>{n.r(t),n.d(t,{default:()=>h});var r=n(5155),a=n(2115),i=n(2619),o=n.n(i),l=n(5027),s=n.n(l);let d={NordCup:"#3d5875",Brevet:"#6b4c9a",RTF:"#2a7d4f",Jedermann:"#b8860b"},c={NordCup:"nordcup",Brevet:"brevet",RTF:"rtf",Jedermann:"jedermann"},p=[{id:1,name:"Ostholstein Extrem",date:"26.04.2026",dateSort:"2026-04-26",club:"RST L\xfcbeck e.V.",link:"https://rst-luebeck.de/",lat:53.8655,lon:10.6866,location:"L\xfcbeck",serie:"NordCup",typ:"Radmarathon",region:"Schleswig-Holstein",distances:["112 km","155 km","205 km"]},{id:2,name:"Holsteiner Pfeil XXL",date:"10.05.2026",dateSort:"2026-05-10",club:"RST Malente e.V.",link:"http://www.radsport-team-malente.de/",lat:54.168,lon:10.558,location:"Bad Malente",serie:"NordCup",typ:"Radmarathon",region:"Schleswig-Holstein",distances:["116 km","155 km","207 km"]},{id:3,name:"Nordsee Radmarathon",date:"17.05.2026",dateSort:"2026-05-17",club:"RSV Husum",link:"https://www.rsv-husum.de/",lat:54.4764,lon:9.0519,location:"Husum",serie:"NordCup",typ:"Radmarathon",region:"Schleswig-Holstein",distances:["110 km","156 km","210 km"]},{id:4,name:"Viking Bike Challenge",date:"07.06.2026",dateSort:"2026-06-07",club:"RV Schleswig e.V.",link:"https://rv-schleswig.de/",lat:54.5153,lon:9.5707,location:"Schleswig",serie:"NordCup",typ:"Radmarathon",region:"Schleswig-Holstein",distances:["115 km","155 km","204 km"],komoot:"https://www.komoot.com/de-de/tour/2165067343",hasTrack:!0},{id:5,name:"Bike Challenge Mittelholstein",date:"21.06.2026",dateSort:"2026-06-21",club:"RSG Mittelpunkt Nortorf e.V.",link:"https://www.nortorf.bike/",lat:54.1658,lon:9.8545,location:"Nortorf",serie:"NordCup",typ:"Radmarathon",region:"Schleswig-Holstein",distances:["112 km","157 km","210 km"]},{id:6,name:"Sparkasse Mittelholstein AG Kanalfahrt",date:"05.07.2026",dateSort:"2026-07-05",club:"RBC Rendsburg e.V.",link:"https://www.rbc-1894.de/",lat:54.3001,lon:9.6643,location:"Rendsburg",serie:"NordCup",typ:"Radmarathon",region:"Schleswig-Holstein",distances:["110 km","152 km","206 km"]},{id:7,name:"Rund um den Kattenberg",date:"02.08.2026",dateSort:"2026-08-02",club:"RSC Kattenberg e.V.",link:"https://www.rsc-kattenberg.de/",lat:53.784,lon:9.875,location:"Buchholz i.d. Nordheide",serie:"NordCup",typ:"Radmarathon",region:"Niedersachsen",distances:["112 km","155 km","203 km"]},{id:8,name:"Geest-Radmarathon",date:"16.08.2026",dateSort:"2026-08-16",club:"VfL Stade — Radsport",link:"https://www.vfl-stade.de/abteilungen/radsport",lat:53.5976,lon:9.4764,location:"Stade",serie:"NordCup",typ:"Radmarathon",region:"Niedersachsen",distances:["120 km","160 km","210 km"]},{id:9,name:"Kaperfahrt & Marathon to Hell",date:"06.09.2026",dateSort:"2026-09-06",club:"FC St. Pauli Radsport",link:"https://fcstpauli-radsport.de/",lat:53.5511,lon:9.9937,location:"Hamburg",serie:"NordCup",typ:"Radmarathon",region:"Hamburg",distances:["115 km","165 km","215 km"]},{id:10,name:"Brevet 200 — Ostseewind",date:"15.03.2026",dateSort:"2026-03-15",club:"ARA Hamburg",link:"https://www.audax-randonneure.de/",lat:53.5753,lon:10.0153,location:"Hamburg",serie:"Brevet",typ:"Brevet",region:"Hamburg",distances:["200 km"]},{id:11,name:"Brevet 300 — L\xfcneburger Heide",date:"18.04.2026",dateSort:"2026-04-18",club:"ARA Hamburg",link:"https://www.audax-randonneure.de/",lat:53.2485,lon:10.4128,location:"L\xfcneburg",serie:"Brevet",typ:"Brevet",region:"Niedersachsen",distances:["300 km"]},{id:12,name:"Brevet 400 — Nordsee-Ostsee",date:"16.05.2026",dateSort:"2026-05-16",club:"ARA Nord",link:"https://www.audax-randonneure.de/",lat:54.3233,lon:10.1228,location:"Kiel",serie:"Brevet",typ:"Brevet",region:"Schleswig-Holstein",distances:["400 km"]},{id:13,name:"Brevet 600 — D\xe4nemark-Runde",date:"13.06.2026",dateSort:"2026-06-13",club:"ARA Nord",link:"https://www.audax-randonneure.de/",lat:54.7937,lon:9.435,location:"Flensburg",serie:"Brevet",typ:"Brevet",region:"Schleswig-Holstein",distances:["600 km"]},{id:14,name:"Fr\xfchjahrs-RTF Neum\xfcnster",date:"29.03.2026",dateSort:"2026-03-29",club:"RC Neum\xfcnster",link:"",lat:54.0712,lon:9.9852,location:"Neum\xfcnster",serie:"RTF",typ:"RTF",region:"Schleswig-Holstein",distances:["45 km","75 km","115 km"]},{id:15,name:"RTF Rund um den Sachsenwald",date:"19.04.2026",dateSort:"2026-04-19",club:"RSG Sachsenwald",link:"",lat:53.5344,lon:10.3362,location:"Reinbek",serie:"RTF",typ:"RTF",region:"Schleswig-Holstein",distances:["42 km","72 km","112 km"]},{id:16,name:"RTF Altes Land",date:"03.05.2026",dateSort:"2026-05-03",club:"RV Jork",link:"",lat:53.5322,lon:9.6778,location:"Jork",serie:"RTF",typ:"RTF",region:"Niedersachsen",distances:["48 km","78 km","120 km"]},{id:17,name:"RTF Fehmarn-Tour",date:"07.06.2026",dateSort:"2026-06-07",club:"RSV Fehmarn",link:"",lat:54.4376,lon:11.1953,location:"Burg auf Fehmarn",serie:"RTF",typ:"RTF",region:"Schleswig-Holstein",distances:["50 km","80 km","110 km"]},{id:18,name:"RTF Mecklenburg Seen",date:"28.06.2026",dateSort:"2026-06-28",club:"RSV Schwerin",link:"",lat:53.6355,lon:11.4015,location:"Schwerin",serie:"RTF",typ:"RTF",region:"Mecklenburg-Vorpommern",distances:["55 km","90 km","130 km"]},{id:19,name:"Hamburger Cyclassics — Jedermann",date:"16.08.2026",dateSort:"2026-08-16",club:"Ironman Hamburg GmbH",link:"https://www.cyclassics-hamburg.de/",lat:53.5563,lon:9.9867,location:"Hamburg",serie:"Jedermann",typ:"Jedermann-Rennen",region:"Hamburg",distances:["60 km","100 km","160 km"]},{id:20,name:"Ostseeman — Jedermann Radrennen",date:"02.08.2026",dateSort:"2026-08-02",club:"SC M\xfchlbrook",link:"https://www.ostseeman.de/",lat:54.2375,lon:10.0325,location:"Bordesholm",serie:"Jedermann",typ:"Jedermann-Rennen",region:"Schleswig-Holstein",distances:["90 km"]},{id:21,name:"Rund um den Henstedter Berg",date:"30.08.2026",dateSort:"2026-08-30",club:"RSG Henstedt-Ulzburg",link:"",lat:53.797,lon:9.9805,location:"Henstedt-Ulzburg",serie:"Jedermann",typ:"Jedermann-Rennen",region:"Schleswig-Holstein",distances:["55 km","85 km"]},{id:22,name:"Rostocker Jedermann-Radrennen",date:"20.09.2026",dateSort:"2026-09-20",club:"PSV Rostock",link:"",lat:54.0887,lon:12.1407,location:"Rostock",serie:"Jedermann",typ:"Jedermann-Rennen",region:"Mecklenburg-Vorpommern",distances:["50 km","100 km"]}],u=[[54.523263,9.538306],[54.523525,9.536006],[54.524232,9.535152],[54.524226,9.533329],[54.523967,9.530577],[54.52396,9.527923],[54.522445,9.527418],[54.520997,9.525926],[54.519557,9.523176],[54.51864,9.521142],[54.518314,9.519428],[54.516,9.513],[54.51,9.503],[54.504,9.495],[54.498,9.489],[54.493,9.482],[54.488249,9.477307],[54.482,9.452],[54.478,9.435],[54.475399,9.418024],[54.470358,9.418389],[54.472654,9.47316],[54.465,9.496],[54.452,9.512],[54.439072,9.52037],[54.449,9.545],[54.462301,9.56099],[54.452243,9.572758],[54.46082,9.593821],[54.464363,9.670621],[54.471,9.695],[54.480822,9.711607],[54.47,9.735],[54.4546,9.753642],[54.445843,9.767294],[54.425,9.773],[54.405898,9.777802],[54.385,9.798],[54.367239,9.819343],[54.366315,9.820111],[54.37,9.78],[54.373,9.738],[54.376,9.7],[54.379112,9.673691],[54.389,9.665],[54.398752,9.65562],[54.40041,9.64188],[54.41,9.636],[54.421128,9.629637],[54.43,9.66],[54.436197,9.711652],[54.437276,9.712686],[54.448,9.69],[54.45792,9.669567],[54.45994,9.66634],[54.47,9.68],[54.48426,9.70483],[54.48269,9.744662],[54.497,9.735],[54.51,9.726],[54.517445,9.723166],[54.521306,9.747395],[54.524154,9.767027],[54.52992,9.769021],[54.5374,9.78021],[54.541165,9.793956],[54.543122,9.797718],[54.542697,9.804159],[54.544778,9.824105],[54.552771,9.829806],[54.557272,9.832339],[54.56305,9.837853],[54.567259,9.836492],[54.574652,9.847766],[54.58244,9.853052],[54.59056,9.859127],[54.587254,9.910087],[54.592068,9.911152],[54.598089,9.912021],[54.60273,9.916906],[54.607275,9.91607],[54.611254,9.919022],[54.62109,9.933229],[54.623566,9.942247],[54.640315,9.950206],[54.64877,9.951647],[54.649463,9.923146],[54.637423,9.919616],[54.631131,9.896506],[54.62,9.87],[54.606673,9.848513],[54.604134,9.836477],[54.595,9.822],[54.589025,9.812224],[54.58279,9.784724],[54.587831,9.781365],[54.580416,9.747411],[54.567577,9.739084],[54.57716,9.68986],[54.59,9.698],[54.60326,9.701696],[54.608248,9.697563],[54.613125,9.701704],[54.61,9.66],[54.607285,9.610631],[54.604292,9.582511],[54.610134,9.552055],[54.595,9.553],[54.576901,9.555942],[54.585,9.525],[54.595,9.5],[54.603465,9.48416],[54.591996,9.493555],[54.574411,9.494219],[54.555,9.496],[54.537808,9.497377],[54.53,9.51],[54.524122,9.526892],[54.523525,9.536006],[54.523263,9.538306]],m={de:{title:"Radsport Norddeutschland",myArea:"Mein Bereich",menu:"Men\xfc",events2026:"Veranstaltungen 2026",events:"Events",series:"Serien",season:"Saison",serieFilter:"Serie / Veranstaltung",typeFilter:"Typ",regionFilter:"Region",resetFilters:"✕ Filter zur\xfccksetzen",noResults:"Keine Veranstaltungen f\xfcr diesen Filter gefunden.",mapHeader:"Karte — Norddeutschland",eventDetail:"⚔️ Event-Detailseite →",website:"Website →"},en:{title:"Cycling Northern Germany",myArea:"My Dashboard",menu:"Menu",events2026:"Events 2026",events:"Events",series:"Series",season:"Season",serieFilter:"Series / Event",typeFilter:"Type",regionFilter:"Region",resetFilters:"✕ Reset Filters",noResults:"No events found for this filter.",mapHeader:"Map — Northern Germany",eventDetail:"⚔️ Event Details →",website:"Website →"}},g={nordcup:"#3d5875",brevet:"#6b4c9a",rtf:"#2a7d4f",jedermann:"#b8860b"};function h(){let e=function(){let[e,t]=(0,a.useState)("de");return(0,a.useEffect)(()=>{try{let e=localStorage.getItem("nordcup-prefs");if(e){let n=JSON.parse(e);("en"===n.lang||"de"===n.lang)&&t(n.lang)}}catch(e){}},[]),e}(),t=m[e],n=(0,a.useRef)(null),i=(0,a.useRef)(null),l=(0,a.useRef)({}),h=(0,a.useRef)(null),[k,x]=(0,a.useState)(null),[y,v]=(0,a.useState)(!1),[S,w]=(0,a.useState)({serie:new Set,typ:new Set,region:new Set}),R=(0,a.useMemo)(()=>[...new Set(p.map(e=>e.serie))],[]),j=(0,a.useMemo)(()=>[...new Set(p.map(e=>e.typ))],[]),D=(0,a.useMemo)(()=>[...new Set(p.map(e=>e.region))],[]),C=(0,a.useMemo)(()=>p.filter(e=>(!S.serie.size||!!S.serie.has(e.serie))&&(!S.typ.size||!!S.typ.has(e.typ))&&(!S.region.size||!!S.region.has(e.region))),[S]),F=(0,a.useMemo)(()=>[...C].sort((e,t)=>e.dateSort.localeCompare(t.dateSort)),[C]),z=(0,a.useMemo)(()=>{let t="en"===e?["Jan","Feb","Mar","Apr","May","Jun","Jul","Aug","Sep","Oct","Nov","Dec"]:["Jan","Feb","M\xe4r","Apr","Mai","Jun","Jul","Aug","Sep","Okt","Nov","Dez"];if(!F.length)return{events:0,series:0,season:"—"};let n=new Date(F[0].dateSort),r=new Date(F[F.length-1].dateSort);return{events:C.length,series:new Set(C.map(e=>e.serie)).size,season:"".concat(t[n.getMonth()],"–").concat(t[r.getMonth()])}},[C,F,e]);(0,a.useEffect)(()=>{if(!i.current||n.current)return;let e=s().map(i.current,{center:[54,10],zoom:8,zoomControl:!0});s().tileLayer("https://{s}.basemaps.cartocdn.com/dark_all/{z}/{x}/{y}{r}.png",{attribution:'&copy; <a href="https://carto.com/attributions">Carto</a> &mdash; \xa9 OpenStreetMap',maxZoom:18}).addTo(e),n.current=e;let t=()=>e.invalidateSize();return window.addEventListener("resize",t),()=>{window.removeEventListener("resize",t),e.remove(),n.current=null}},[]),(0,a.useEffect)(()=>{let t=n.current;t&&(Object.values(l.current).forEach(e=>t.removeLayer(e)),l.current={},0!==C.length&&(C.forEach((n,r)=>{let a=function(e,t){let n=arguments.length>2&&void 0!==arguments[2]?arguments[2]:34,r="s".concat(e,"_").concat(t.replace("#",""),"_").concat(n),a="<svg xmlns='http://www.w3.org/2000/svg' width='".concat(n,"' height='").concat(n,"' viewBox='0 0 ").concat(n," ").concat(n,"'>\n    <defs>\n      <filter id='").concat(r,"' x='-50%' y='-50%' width='200%' height='200%'>\n        <feDropShadow dx='0' dy='2' stdDeviation='2.5' flood-color='rgba(0,0,0,0.4)' flood-opacity='0.7'/>\n      </filter>\n    </defs>\n    <circle cx='").concat(n/2,"' cy='").concat(n/2-2,"' r='").concat(n/2-4,"' fill='").concat(t,"' stroke='rgba(255,255,255,0.2)' stroke-width='1.5' filter='url(#").concat(r,")'/>\n    <text x='").concat(n/2,"' y='").concat(n/2+3,"' text-anchor='middle' fill='white' font-size='").concat(.32*n,"' font-weight='800' font-family='Inter,sans-serif'>").concat(e,"</text>\n  </svg>");return s().icon({iconUrl:"data:image/svg+xml;charset=UTF-8,"+encodeURIComponent(a),iconSize:[n,n],iconAnchor:[n/2,n/2],popupAnchor:[0,-n/2+2],className:"custom-marker"})}(r+1,d[n.serie]||"#3d5875"),i=c[n.serie]||"nordcup",o=n.distances?'<div style="margin-top:6px;font-size:0.82rem;color:#98a0b3;">\uD83D\uDEE3️ '.concat(n.distances.join(" \xb7 "),"</div>"):"",p=n.komoot?'<a class="popup-link popup-link--komoot" href="'.concat(n.komoot,'" target="_blank" rel="noopener">\uD83D\uDDFA️ Komoot Route →</a>'):"",u=4===n.id?'<a class="popup-link popup-link--viking" href="/viking-bike-challenge" style="display:inline-block;margin-top:4px;">'.concat("en"===e?"⚔️ Event Details →":"⚔️ Event-Detailseite →","</a>"):"",m=s().marker([n.lat,n.lon],{icon:a}).addTo(t).bindPopup('\n          <div class="popup-name">'.concat(n.name,'</div>\n          <div class="popup-date">\uD83D\uDCC5 ').concat(n.date," \xb7 \uD83D\uDCCD ").concat(n.location,'</div>\n          <div class="popup-club">\uD83C\uDFE2 ').concat(n.club,'</div>\n          <div class="popup-badges">\n            <span class="popup-badge" style="background:').concat(g[i]||"#3d5875",'">').concat(n.serie,'</span>\n            <span class="popup-badge" style="background:rgba(255,255,255,0.08);color:#98a0b3;">').concat(n.typ,"</span>\n          </div>\n          ").concat(o,'\n          <div style="display:flex;gap:4px;flex-wrap:wrap;margin-top:8px;">\n            ').concat(n.link?'<a class="popup-link" href="'.concat(n.link,'" target="_blank" rel="noopener">Website →</a>'):"","\n            ").concat(p,"\n          </div>\n          ").concat(u,"\n        "));m.on("click",()=>x(n.id)),m.on("popupclose",()=>{window.innerWidth<=768||x(null)}),l.current[n.id]=m}),t.fitBounds(C.map(e=>[e.lat,e.lon]),{padding:[50,50]})))},[C]),(0,a.useEffect)(()=>{let e=n.current;e&&(h.current&&(e.removeLayer(h.current),h.current=null),4===k&&(h.current=s().polyline(u,{color:"#e8491d",weight:3,opacity:.75,dashArray:"8, 6",lineCap:"round"}).addTo(e)))},[k]);let H=(0,a.useCallback)(e=>{x(e);let t=p.find(t=>t.id===e);if(t&&n.current&&(n.current.flyTo([t.lat,t.lon],Math.max(n.current.getZoom(),10),{duration:.5}),!(window.innerWidth<=768))){var r;null==(r=l.current[e])||r.openPopup()}},[]),N=(0,a.useCallback)((e,t)=>{x(null),w(n=>{let r={...n,serie:new Set(n.serie),typ:new Set(n.typ),region:new Set(n.region)};return r[e].has(t)?r[e].delete(t):r[e].add(t),r})},[]),T=(0,a.useCallback)(()=>{x(null),w({serie:new Set,typ:new Set,region:new Set})},[]),M=S.serie.size>0||S.typ.size>0||S.region.size>0,B={"Schleswig-Holstein":"rgba(255,255,255,0.15)",Hamburg:"rgba(255,255,255,0.15)",Niedersachsen:"rgba(255,255,255,0.15)","Mecklenburg-Vorpommern":"rgba(255,255,255,0.15)"};return(0,r.jsxs)("div",{style:{display:"flex",flexDirection:"column",height:"100vh",overflow:"hidden"},children:[(0,r.jsxs)("header",{style:{background:"rgba(11,18,32,0.95)",backdropFilter:"blur(8px)",boxShadow:"0 1px 6px rgba(0,0,0,0.4)",zIndex:1e3,height:56,display:"flex",alignItems:"center",justifyContent:"space-between",padding:"0 20px",flexShrink:0},children:[(0,r.jsxs)("h1",{style:{fontSize:18,fontWeight:700,margin:0,display:"flex",alignItems:"center",gap:10},children:[(0,r.jsx)("span",{children:"\uD83D\uDEB4"}),t.title,(0,r.jsx)("span",{style:{background:"var(--accent)",color:"#fff",padding:"3px 10px",borderRadius:999,fontSize:"0.7rem",fontWeight:700,letterSpacing:"0.5px"},children:"2026"})]}),(0,r.jsxs)("div",{style:{display:"flex",alignItems:"center",gap:10},children:[(0,r.jsxs)(o(),{href:"/mein-bereich",style:{display:"flex",alignItems:"center",gap:6,padding:"6px 14px",background:"rgba(61,125,214,0.1)",border:"1px solid rgba(61,125,214,0.2)",borderRadius:8,color:"#7cb3e8",fontSize:13,fontWeight:600},children:["\uD83D\uDEB4 ",t.myArea]}),(0,r.jsx)("button",{onClick:()=>v(e=>!e),style:{display:"none",background:"transparent",border:"none",color:"var(--white)",cursor:"pointer",fontSize:22,padding:4},className:"mobile-menu-btn","aria-label":t.menu,children:"☰"})]})]}),(0,r.jsxs)("div",{style:{flex:1,display:"flex",minHeight:0,gap:16,padding:16},children:[(0,r.jsxs)("aside",{style:{width:400,background:"var(--card)",borderRadius:14,boxShadow:"0 8px 30px rgba(2,6,23,0.6)",display:"flex",flexDirection:"column",gap:14,padding:20,flexShrink:0,overflowY:"auto"},children:[(0,r.jsx)("h2",{style:{fontSize:"1.15rem",margin:0},children:t.events2026}),(0,r.jsx)("div",{style:{display:"flex",gap:16},children:[{value:z.events,label:t.events},{value:z.series,label:t.series},{value:z.season,label:t.season}].map(e=>(0,r.jsxs)("div",{style:{textAlign:"center"},children:[(0,r.jsx)("div",{style:{fontSize:"1.4rem",fontWeight:800,color:"var(--white)"},children:e.value}),(0,r.jsx)("div",{style:{fontSize:"0.7rem",color:"var(--muted)",textTransform:"uppercase",letterSpacing:"0.5px"},children:e.label})]},e.label))}),(0,r.jsxs)("div",{style:{display:"flex",flexDirection:"column",gap:10},children:[(0,r.jsx)(b,{label:t.serieFilter,values:R,active:S.serie,getColor:e=>g[c[e]||"nordcup"]||"#3d5875",onToggle:e=>N("serie",e)}),(0,r.jsx)(b,{label:t.typeFilter,values:j,active:S.typ,getColor:()=>"#3d5875",onToggle:e=>N("typ",e)}),(0,r.jsx)(b,{label:t.regionFilter,values:D,active:S.region,getColor:e=>B[e]||"#3d5875",onToggle:e=>N("region",e)}),M&&(0,r.jsxs)("button",{onClick:T,style:{padding:"4px 10px",borderRadius:6,fontSize:"0.75rem",cursor:"pointer",border:"none",background:"rgba(232,73,29,0.15)",color:"var(--accent-2)",fontWeight:600,alignSelf:"flex-start"},children:["✕ ",t.resetFilters.replace("✕ ","")]})]}),(0,r.jsx)("div",{style:{height:1,background:"rgba(255,255,255,0.05)"}}),(0,r.jsx)("div",{style:{flex:1,overflowY:"auto",minHeight:0},children:0===F.length?(0,r.jsx)("div",{style:{textAlign:"center",padding:"30px 10px",color:"var(--muted)",fontSize:"0.9rem"},children:t.noResults}):(0,r.jsx)("ul",{style:{listStyle:"none",padding:0,margin:0,display:"grid",gap:8},children:F.map((e,t)=>(0,r.jsx)(f,{ev:e,idx:t+1,selected:k===e.id,onClick:()=>H(e.id)},e.id))})})]}),(0,r.jsxs)("main",{style:{flex:1,minHeight:0,borderRadius:14,overflow:"hidden",background:"linear-gradient(180deg, rgba(255,255,255,0.01), rgba(255,255,255,0.02))",display:"flex",flexDirection:"column"},children:[(0,r.jsxs)("div",{style:{padding:"10px 16px 6px",display:"flex",alignItems:"center",justifyContent:"space-between",flexShrink:0},children:[(0,r.jsx)("strong",{style:{fontSize:"0.95rem"},children:t.mapHeader}),(0,r.jsx)("div",{style:{display:"flex",gap:12,fontSize:"0.75rem"},children:[{color:"#3d5875",label:"NordCup"},{color:"#6b4c9a",label:"Brevet"},{color:"#2a7d4f",label:"RTF"},{color:"#b8860b",label:"Jedermann"}].map(e=>(0,r.jsxs)("span",{style:{display:"flex",alignItems:"center",gap:4,color:"var(--muted)"},children:[(0,r.jsx)("span",{style:{width:10,height:10,borderRadius:"50%",background:e.color,display:"inline-block"}}),e.label]},e.label))})]}),(0,r.jsx)("div",{ref:i,style:{flex:1,minHeight:0}})]})]}),(0,r.jsx)("style",{children:"\n        @media (max-width: 768px) {\n          aside { display: none !important; }\n          .mobile-menu-btn { display: block !important; }\n        }\n      "})]})}function b(e){let{label:t,values:n,active:a,getColor:i,onToggle:o}=e;return(0,r.jsxs)("div",{style:{display:"flex",flexDirection:"column",gap:5},children:[(0,r.jsx)("span",{style:{fontSize:"0.72rem",color:"var(--muted)",textTransform:"uppercase",letterSpacing:"0.8px",fontWeight:600},children:t}),(0,r.jsx)("div",{style:{display:"flex",flexWrap:"wrap",gap:6},children:n.map(e=>{let t=a.has(e);return(0,r.jsx)("span",{onClick:()=>o(e),style:{padding:"5px 12px",borderRadius:999,fontSize:"0.78rem",fontWeight:600,cursor:"pointer",border:"1px solid rgba(255,255,255,0.08)",background:t?i(e):"rgba(255,255,255,0.03)",color:t?"#fff":"var(--muted)",userSelect:"none",transition:"all 150ms ease"},children:e},e)})})]})}function f(e){var t;let{ev:n,idx:a,selected:i,onClick:o}=e,l=new Date,s=new Date(n.dateSort)<l,p=d[n.serie]||"#3d5875",u=c[n.serie]||"nordcup";return(0,r.jsx)("li",{onClick:o,style:{padding:"12px 14px",borderRadius:10,background:i?"rgba(61,88,117,0.12)":"linear-gradient(180deg, rgba(255,255,255,0.012), rgba(255,255,255,0.008))",border:i?"1px solid #3d5875":"1px solid rgba(255,255,255,0.02)",borderLeft:i?"3px solid var(--accent)":void 0,cursor:"pointer",opacity:s?.45:1,transition:"background-color 120ms ease, transform 120ms ease"},children:(0,r.jsxs)("div",{style:{display:"flex",justifyContent:"space-between",alignItems:"flex-start",gap:10},children:[(0,r.jsxs)("div",{style:{display:"flex",gap:10,alignItems:"flex-start"},children:[(0,r.jsx)("span",{style:{display:"inline-flex",alignItems:"center",justifyContent:"center",width:22,height:22,borderRadius:"50%",background:p,color:"#fff",fontSize:"0.65rem",fontWeight:700,flexShrink:0,marginTop:2},children:a}),(0,r.jsxs)("div",{children:[(0,r.jsx)("div",{style:{fontWeight:700,fontSize:"0.92rem"},children:n.name}),(0,r.jsxs)("div",{style:{display:"flex",gap:8,marginTop:4,flexWrap:"wrap"},children:[(0,r.jsxs)("span",{style:{color:"var(--muted)",fontSize:"0.82em"},children:["\uD83D\uDCC5 ",n.date]}),(0,r.jsxs)("span",{style:{color:"var(--muted)",fontSize:"0.82em"},children:["\uD83D\uDCCD ",n.location]})]}),(0,r.jsxs)("div",{style:{color:"var(--muted)",fontSize:"0.78em",marginTop:2},children:["\uD83C\uDFE2 ",n.club]}),(0,r.jsxs)("div",{style:{display:"flex",gap:4,marginTop:6,flexWrap:"wrap"},children:[(0,r.jsx)("span",{style:{padding:"2px 8px",borderRadius:999,fontSize:"0.68rem",fontWeight:700,background:g[u]||"#3d5875",color:"#fff"},children:n.serie}),null==(t=n.distances)?void 0:t.map(e=>(0,r.jsx)("span",{style:{padding:"2px 8px",borderRadius:999,fontSize:"0.68rem",background:"rgba(255,255,255,0.08)",color:"var(--muted)",fontWeight:600},children:e},e)),n.komoot&&(0,r.jsx)("a",{href:n.komoot,target:"_blank",rel:"noopener",onClick:e=>e.stopPropagation(),style:{padding:"2px 8px",borderRadius:999,fontSize:"0.68rem",fontWeight:700,background:"rgba(107,178,40,0.2)",color:"#8fce44"},children:"\uD83D\uDDFA️ Komoot"})]})]})]}),n.link&&(0,r.jsx)("a",{href:n.link,target:"_blank",rel:"noopener",onClick:e=>e.stopPropagation(),style:{fontSize:"1rem",opacity:.7,textDecoration:"none"},title:"Website",children:"\uD83D\uDD17"})]})})}}}]);